{
  "meta": {
    "version": "3.1",
    "generated": "2025-11-23T17:28:25.460220Z",
    "project": "cli"
  },
  "docstrings_text": [
    "CLI for TECH-INDEX generation - PY-Indexer v3.0.\n\nCommand-line interface for generating TECH-INDEX from Python projects.\n\nAuthor: PY-Indexer Development Team\nDate: 2025-11-22",
    "CLI for TECH-INDEX generation.\n\nHandles command-line arguments and orchestrates the indexing process.",
    "Initialize CLI.",
    "Run TECH-INDEX generation.\n\nParameters\n----------\nargs : list[str]\n    Command-line arguments\n    \nReturns\n-------\nint\n    Exit code (0 = success, 1 = error)",
    "Parse command-line arguments.\n\nParameters\n----------\nargs : list[str]\n    Command-line arguments\n    \nReturns\n-------\nargparse.Namespace\n    Parsed arguments",
    "Get output filename with appropriate extension.\n\nParameters\n----------\noutput_path : str\n    Output directory path\nbase_name : str\n    Base filename without extension\nformat_str : str\n    Format string (json, json.gz, msgpack)\n    \nReturns\n-------\nPath\n    Full output file path",
    "Get serializer for format.\n\nParameters\n----------\nformat_str : str\n    Format string (json, json.gz, msgpack)\nminify : bool\n    Minify JSON output\n    \nReturns\n-------\nBaseSerializer\n    Serializer instance",
    "Main entry point for CLI.\n\nParameters\n----------\nargs : list[str]\n    Command-line arguments\n    \nReturns\n-------\nint\n    Exit code",
    "CLI for TECH-LOCATION generation - PY-Indexer v3.0.\n\nCommand-line interface for generating TECH-LOCATION from TECH-INDEX.\n\nAuthor: PY-Indexer Development Team\nDate: 2025-11-22",
    "CLI for TECH-LOCATION generation.\n\nHandles command-line arguments and orchestrates TECH-LOCATION building.",
    "Run TECH-LOCATION generation.\n\nParameters\n----------\nargs : list[str]\n    Command-line arguments\n    \nReturns\n-------\nint\n    Exit code (0 = success, 1 = error)",
    "Get output filename.\n\nParameters\n----------\noutput_path : str\n    Output directory path\nbase_name : str\n    Base filename without extension\n    \nReturns\n-------\nPath\n    Full output file path"
  ],
  "modules": [
    [
      0,
      [
        [
          0,
          0,
          1,
          7
        ]
      ]
    ],
    [
      19,
      [
        [
          8,
          1,
          1,
          7
        ]
      ]
    ]
  ],
  "classes": [
    [
      1,
      [
        [
          1,
          0,
          28,
          31
        ]
      ]
    ],
    [
      20,
      [
        [
          9,
          1,
          24,
          27
        ]
      ]
    ]
  ],
  "functions": [
    [
      2,
      [
        [
          2,
          0,
          35,
          36
        ]
      ]
    ],
    [
      3,
      [
        [
          3,
          0,
          40,
          49
        ]
      ]
    ],
    [
      4,
      [
        [
          4,
          0,
          157,
          166
        ]
      ]
    ],
    [
      5,
      [
        [
          5,
          0,
          232,
          241
        ]
      ]
    ],
    [
      6,
      [
        [
          6,
          0,
          268,
          277
        ]
      ]
    ],
    [
      7,
      [
        [
          7,
          0,
          293,
          302
        ]
      ]
    ],
    [
      21,
      [
        [
          2,
          1,
          31,
          32
        ]
      ]
    ],
    [
      22,
      [
        [
          10,
          1,
          36,
          45
        ]
      ]
    ],
    [
      23,
      [
        [
          4,
          1,
          118,
          127
        ]
      ]
    ],
    [
      24,
      [
        [
          11,
          1,
          157,
          166
        ]
      ]
    ],
    [
      25,
      [
        [
          7,
          1,
          177,
          186
        ]
      ]
    ]
  ]
}